{"actions_by_effect_class":{"external_communication":0,"irreversible":0,"physical":0,"read":0,"spend":0,"unspecified":0,"write":1},"agents":["spiffe://corp/agents/credit-langgraph"],"approvals_by_recorder":{"enforcement_point":0,"independent_system":0,"self_report":0},"denied_or_blocked":{"approval_rejected":0,"authz_denied":0,"policy_denied":0,"refused":0},"models":[],"tools":[{"name":"credit.record_decision","protocol":"mcp","server":"mcp://credit-core.internal"}],"undeclared":{"agents":[],"models":[],"tools":["credit.record_decision"]}}